{
  "$schema": "https://json-schema.org/draft/2020-12/schema",
  "title": "Persona",
  "type": "object",
  "properties": {
    "id": {
      "type": "string"
    },
    "name": {
      "type": "string"
    },
    "style": {
      "type": "object"
    },
    "skills": {
      "type": "array",
      "items": {
        "type": "string"
      }
    },
    "biases": {
      "type": "array",
      "items": {
        "type": "string"
      }
    },
    "risk_limits": {
      "type": "object"
    },
    "tools": {
      "type": "array",
      "items": {
        "type": "string"
      }
    },
    "context_pack": {
      "type": "array",
      "items": {
        "type": "string"
      }
    }
  },
  "required": [
    "id",
    "name",
    "skills"
  ]
}